12:07:10.412938 ARP, Request who-has stratos.di.uoa.gr tell sofia.di.uoa.gr, length 46
12:07:10.474765 ARP, Request who-has 195.134.66.102 tell 195.134.66.1, length 46
12:07:10.616812 ARP, Request who-has 195.134.66.110 tell 195.134.66.1, length 46
12:07:10.638369 ARP, Request who-has 195.134.66.192 tell 195.134.66.1, length 46
12:07:10.746821 ARP, Request who-has galactica.di.uoa.gr tell 195.134.66.1, length 46
12:07:10.746838 ARP, Request who-has kthnos.di.uoa.gr tell 195.134.66.1, length 46
12:07:10.797014 IP 192.168.43.12.46750 > fabulous.di.uoa.gr.9092: Flags [S], seq 3429698680, win 29200, options [mss 1460,sackOK,TS val 1323925222 ecr 0,nop,wscale 7], length 0
12:07:11.061376 ARP, Request who-has 195.134.66.214 tell esperos.di.uoa.gr, length 46
12:07:11.108612 IP fabulous.di.uoa.gr.9092 > 192.168.43.12.46750: Flags [S.], seq 2755710181, ack 3429698681, win 28960, options [mss 1360,sackOK,TS val 581060005 ecr 1323925222,nop,wscale 1], length 0
12:07:11.108696 IP 192.168.43.12.46750 > fabulous.di.uoa.gr.9092: Flags [.], ack 1, win 229, options [nop,nop,TS val 1323925534 ecr 581060005], length 0
12:07:11.110185 IP 192.168.43.12.46750 > fabulous.di.uoa.gr.9092: Flags [P.], seq 1:42, ack 1, win 229, options [nop,nop,TS val 1323925535 ecr 581060005], length 41
12:07:11.145096 IP fabulous.di.uoa.gr.9092 > 192.168.43.12.46750: Flags [.], ack 42, win 14480, options [nop,nop,TS val 581060031 ecr 1323925535], length 0
12:07:11.147462 IP fabulous.di.uoa.gr.9092 > 192.168.43.12.46750: Flags [.], seq 1:1349, ack 42, win 14480, options [nop,nop,TS val 581060031 ecr 1323925535], length 1348
12:07:11.147531 IP 192.168.43.12.46750 > fabulous.di.uoa.gr.9092: Flags [.], ack 1349, win 251, options [nop,nop,TS val 1323925573 ecr 581060031], length 0
12:07:11.148243 IP fabulous.di.uoa.gr.9092 > 192.168.43.12.46750: Flags [.], seq 1349:2697, ack 42, win 14480, options [nop,nop,TS val 581060031 ecr 1323925535], length 1348
12:07:11.148274 IP 192.168.43.12.46750 > fabulous.di.uoa.gr.9092: Flags [.], ack 2697, win 274, options [nop,nop,TS val 1323925573 ecr 581060031], length 0
12:07:11.151187 IP fabulous.di.uoa.gr.9092 > 192.168.43.12.46750: Flags [P.], seq 2697:2713, ack 42, win 14480, options [nop,nop,TS val 581060031 ecr 1323925535], length 16
12:07:11.151234 IP 192.168.43.12.46750 > fabulous.di.uoa.gr.9092: Flags [.], ack 2713, win 274, options [nop,nop,TS val 1323925576 ecr 581060031], length 0
12:07:11.157067 IP 192.168.43.12.46750 > fabulous.di.uoa.gr.9092: Flags [F.], seq 42, ack 2713, win 274, options [nop,nop,TS val 1323925582 ecr 581060031], length 0
12:07:11.159913 IP localhost.42619 > voyager.domain: 25290+ A? fabulous.di.uoa.gr. (36)
12:07:11.159922 IP localhost.42619 > voyager.domain: 37739+ AAAA? fabulous.di.uoa.gr. (36)
12:07:11.159959 IP 192.168.43.12.44957 > 192.168.43.1.domain: 13503+ A? fabulous.di.uoa.gr. (36)
12:07:11.159978 IP6 2a02:1388:9e:a37c:3464:d170:5678:7d74.34240 > anycastdns1.cosmote.net.domain: 13503+ A? fabulous.di.uoa.gr. (36)
12:07:11.159984 IP6 2a02:1388:9e:a37c:3464:d170:5678:7d74.34240 > anycastdns2.cosmote.net.domain: 13503+ A? fabulous.di.uoa.gr. (36)
12:07:11.159998 IP6 2a02:1388:9e:a37c:3464:d170:5678:7d74.34240 > anycastdns1.cosmote.net.domain: 60148+ AAAA? fabulous.di.uoa.gr. (36)
12:07:11.197531 IP6 anycastdns1.cosmote.net.domain > 2a02:1388:9e:a37c:3464:d170:5678:7d74.34240: 13503 1/0/0 A 195.134.71.250 (52)
12:07:11.197684 IP voyager.domain > localhost.42619: 25290 1/0/0 A 195.134.71.250 (52)
12:07:11.201101 IP6 anycastdns2.cosmote.net.domain > 2a02:1388:9e:a37c:3464:d170:5678:7d74.34240: 13503 1/0/0 A 195.134.71.250 (52)
12:07:11.201432 IP 192.168.43.1.domain > 192.168.43.12.44957: 13503 1/0/0 A 195.134.71.250 (52)
12:07:11.203059 IP fabulous.di.uoa.gr.9092 > 192.168.43.12.46750: Flags [F.], seq 2713, ack 43, win 14480, options [nop,nop,TS val 581060045 ecr 1323925582], length 0
12:07:11.203119 IP 192.168.43.12.46750 > fabulous.di.uoa.gr.9092: Flags [.], ack 2714, win 274, options [nop,nop,TS val 1323925628 ecr 581060045], length 0
12:07:11.204388 IP6 anycastdns1.cosmote.net.domain > 2a02:1388:9e:a37c:3464:d170:5678:7d74.34240: 60148 0/1/0 (87)
12:07:11.204605 IP voyager.domain > localhost.42619: 37739 0/1/0 (87)
12:07:11.205199 IP 192.168.43.12.46752 > fabulous.di.uoa.gr.9092: Flags [S], seq 977870937, win 29200, options [mss 1460,sackOK,TS val 1323925630 ecr 0,nop,wscale 7], length 0
12:07:11.205904 IP localhost.51423 > voyager.domain: 43095+ A? fabulous.di.uoa.gr. (36)
12:07:11.205931 IP localhost.51423 > voyager.domain: 44384+ AAAA? fabulous.di.uoa.gr. (36)
12:07:11.206091 IP6 2a02:1388:9e:a37c:3464:d170:5678:7d74.34240 > anycastdns1.cosmote.net.domain: 36349+ A? fabulous.di.uoa.gr. (36)
12:07:11.206174 IP6 2a02:1388:9e:a37c:3464:d170:5678:7d74.34240 > anycastdns1.cosmote.net.domain: 60485+ AAAA? fabulous.di.uoa.gr. (36)
12:07:11.267006 IP6 anycastdns1.cosmote.net.domain > 2a02:1388:9e:a37c:3464:d170:5678:7d74.34240: 36349 1/0/0 A 195.134.71.250 (52)
12:07:11.267230 IP6 anycastdns1.cosmote.net.domain > 2a02:1388:9e:a37c:3464:d170:5678:7d74.34240: 60485 0/1/0 (87)
12:07:11.267381 IP voyager.domain > localhost.51423: 43095 1/0/0 A 195.134.71.250 (52)
12:07:11.267483 IP voyager.domain > localhost.51423: 44384 0/1/0 (87)
12:07:11.267985 IP fabulous.di.uoa.gr.9092 > 192.168.43.12.46752: Flags [S.], seq 2252989353, ack 977870938, win 28960, options [mss 1360,sackOK,TS val 581060060 ecr 1323925630,nop,wscale 1], length 0
12:07:11.268063 IP 192.168.43.12.46752 > fabulous.di.uoa.gr.9092: Flags [.], ack 1, win 229, options [nop,nop,TS val 1323925693 ecr 581060060], length 0
12:07:11.268909 IP 192.168.43.12.46752 > fabulous.di.uoa.gr.9092: Flags [P.], seq 1:38, ack 1, win 229, options [nop,nop,TS val 1323925694 ecr 581060060], length 37
12:07:11.307933 IP localhost.37181 > voyager.domain: 50315+ PTR? 31.66.134.195.in-addr.arpa. (44)
12:07:11.308203 IP6 2a02:1388:9e:a37c:3464:d170:5678:7d74.34240 > anycastdns1.cosmote.net.domain: 11717+ PTR? 31.66.134.195.in-addr.arpa. (44)
12:07:11.309994 IP fabulous.di.uoa.gr.9092 > 192.168.43.12.46752: Flags [P.], seq 1:219, ack 38, win 14480, options [nop,nop,TS val 581060072 ecr 1323925694], length 218
12:07:11.310058 IP 192.168.43.12.46752 > fabulous.di.uoa.gr.9092: Flags [.], ack 219, win 237, options [nop,nop,TS val 1323925735 ecr 581060072], length 0
12:07:11.310512 IP fabulous.di.uoa.gr.9092 > 192.168.43.12.46752: Flags [.], ack 38, win 14480, options [nop,nop,TS val 581060072 ecr 1323925694], length 0
12:07:11.310562 IP 192.168.43.12.46752 > fabulous.di.uoa.gr.9092: Flags [.], ack 219, win 237, options [nop,nop,TS val 1323925736 ecr 581060072], length 0
12:07:11.349644 IP yperionas.di.uoa.gr.17500 > 255.255.255.255.17500: UDP, length 240
12:07:11.359317 IP yperionas.di.uoa.gr.17500 > 195.134.66.255.17500: UDP, length 240
12:07:11.359334 IP yperionas.di.uoa.gr.17500 > 255.255.255.255.17500: UDP, length 240
12:07:11.359871 IP yperionas.di.uoa.gr.17500 > 255.255.255.255.17500: UDP, length 240
12:07:11.359886 IP yperionas.di.uoa.gr.17500 > 255.255.255.255.17500: UDP, length 240
12:07:11.360430 IP yperionas.di.uoa.gr.17500 > 255.255.255.255.17500: UDP, length 240
12:07:11.370043 IP 192.168.43.12.46752 > fabulous.di.uoa.gr.9092: Flags [P.], seq 38:79, ack 219, win 237, options [nop,nop,TS val 1323925795 ecr 581060072], length 41
12:07:11.392501 IP6 anycastdns1.cosmote.net.domain > 2a02:1388:9e:a37c:3464:d170:5678:7d74.34240: 11717 1/0/0 PTR stratos.di.uoa.gr. (75)
12:07:11.392746 IP voyager.domain > localhost.37181: 50315 1/0/0 PTR stratos.di.uoa.gr. (75)
12:07:11.393248 IP localhost.57701 > voyager.domain: 40096+ PTR? 40.66.134.195.in-addr.arpa. (44)
12:07:11.393497 IP6 2a02:1388:9e:a37c:3464:d170:5678:7d74.34240 > anycastdns1.cosmote.net.domain: 750+ PTR? 40.66.134.195.in-addr.arpa. (44)
12:07:11.417639 IP fabulous.di.uoa.gr.9092 > 192.168.43.12.46752: Flags [.], seq 219:1567, ack 79, win 14480, options [nop,nop,TS val 581060098 ecr 1323925795], length 1348
12:07:11.417698 IP 192.168.43.12.46752 > fabulous.di.uoa.gr.9092: Flags [.], ack 1567, win 260, options [nop,nop,TS val 1323925843 ecr 581060098], length 0
12:07:11.418208 IP fabulous.di.uoa.gr.9092 > 192.168.43.12.46752: Flags [.], seq 1567:2915, ack 79, win 14480, options [nop,nop,TS val 581060098 ecr 1323925795], length 1348
12:07:11.418246 IP 192.168.43.12.46752 > fabulous.di.uoa.gr.9092: Flags [.], ack 2915, win 282, options [nop,nop,TS val 1323925843 ecr 581060098], length 0
12:07:11.418654 IP fabulous.di.uoa.gr.9092 > 192.168.43.12.46752: Flags [P.], seq 2915:2931, ack 79, win 14480, options [nop,nop,TS val 581060098 ecr 1323925795], length 16
12:07:11.418690 IP 192.168.43.12.46752 > fabulous.di.uoa.gr.9092: Flags [.], ack 2931, win 282, options [nop,nop,TS val 1323925844 ecr 581060098], length 0
12:07:11.423950 IP 192.168.43.12.46752 > fabulous.di.uoa.gr.9092: Flags [P.], seq 79:116, ack 2931, win 282, options [nop,nop,TS val 1323925849 ecr 581060098], length 37
12:07:11.451355 IP6 anycastdns1.cosmote.net.domain > 2a02:1388:9e:a37c:3464:d170:5678:7d74.34240: 750 1/0/0 PTR sofia.di.uoa.gr. (73)
12:07:11.451463 IP voyager.domain > localhost.57701: 40096 1/0/0 PTR sofia.di.uoa.gr. (73)
12:07:11.451677 IP localhost.50010 > voyager.domain: 19244+ PTR? 102.66.134.195.in-addr.arpa. (45)
12:07:11.451801 IP6 2a02:1388:9e:a37c:3464:d170:5678:7d74.34240 > anycastdns1.cosmote.net.domain: 43672+ PTR? 102.66.134.195.in-addr.arpa. (45)
12:07:11.480461 IP fabulous.di.uoa.gr.9092 > 192.168.43.12.46752: Flags [P.], seq 2931:3149, ack 116, win 14480, options [nop,nop,TS val 581060114 ecr 1323925849], length 218
12:07:11.488358 IP6 anycastdns1.cosmote.net.domain > 2a02:1388:9e:a37c:3464:d170:5678:7d74.34240: 43672 NXDomain 0/1/0 (102)
12:07:11.488595 IP voyager.domain > localhost.50010: 19244 NXDomain 0/1/0 (102)
12:07:11.489009 IP localhost.56527 > voyager.domain: 20111+ PTR? 1.66.134.195.in-addr.arpa. (43)
12:07:11.489251 IP6 2a02:1388:9e:a37c:3464:d170:5678:7d74.34240 > anycastdns1.cosmote.net.domain: 62191+ PTR? 1.66.134.195.in-addr.arpa. (43)
12:07:11.521559 IP 192.168.43.12.46752 > fabulous.di.uoa.gr.9092: Flags [.], ack 3149, win 303, options [nop,nop,TS val 1323925947 ecr 581060114], length 0
12:07:11.524828 IP 192.168.43.12.46752 > fabulous.di.uoa.gr.9092: Flags [P.], seq 116:157, ack 3149, win 303, options [nop,nop,TS val 1323925950 ecr 581060114], length 41
12:07:11.535367 IP6 anycastdns1.cosmote.net.domain > 2a02:1388:9e:a37c:3464:d170:5678:7d74.34240: 62191 NXDomain 0/1/0 (100)
12:07:11.535615 IP voyager.domain > localhost.56527: 20111 NXDomain 0/1/0 (100)
12:07:11.536048 IP localhost.38844 > voyager.domain: 28247+ PTR? 110.66.134.195.in-addr.arpa. (45)
12:07:11.536281 IP6 2a02:1388:9e:a37c:3464:d170:5678:7d74.34240 > anycastdns1.cosmote.net.domain: 19302+ PTR? 110.66.134.195.in-addr.arpa. (45)
12:07:11.545501 ARP, Request who-has spiderman.di.uoa.gr tell 195.134.66.1, length 46
12:07:11.582430 IP fabulous.di.uoa.gr.9092 > 192.168.43.12.46752: Flags [.], seq 3149:4497, ack 157, win 14480, options [nop,nop,TS val 581060138 ecr 1323925950], length 1348
12:07:11.582503 IP 192.168.43.12.46752 > fabulous.di.uoa.gr.9092: Flags [.], ack 4497, win 326, options [nop,nop,TS val 1323926008 ecr 581060138], length 0
12:07:11.582976 IP fabulous.di.uoa.gr.9092 > 192.168.43.12.46752: Flags [.], seq 4497:5845, ack 157, win 14480, options [nop,nop,TS val 581060138 ecr 1323925950], length 1348
12:07:11.583003 IP 192.168.43.12.46752 > fabulous.di.uoa.gr.9092: Flags [.], ack 5845, win 349, options [nop,nop,TS val 1323926008 ecr 581060138], length 0
12:07:11.583619 IP fabulous.di.uoa.gr.9092 > 192.168.43.12.46752: Flags [P.], seq 5845:5861, ack 157, win 14480, options [nop,nop,TS val 581060138 ecr 1323925950], length 16
12:07:11.583643 IP 192.168.43.12.46752 > fabulous.di.uoa.gr.9092: Flags [.], ack 5861, win 349, options [nop,nop,TS val 1323926009 ecr 581060138], length 0
12:07:11.583706 IP6 anycastdns1.cosmote.net.domain > 2a02:1388:9e:a37c:3464:d170:5678:7d74.34240: 19302 NXDomain 0/1/0 (102)
12:07:11.584017 IP voyager.domain > localhost.38844: 28247 NXDomain 0/1/0 (102)
12:07:11.584457 IP localhost.51415 > voyager.domain: 58767+ PTR? 192.66.134.195.in-addr.arpa. (45)
12:07:11.584588 IP6 2a02:1388:9e:a37c:3464:d170:5678:7d74.34240 > anycastdns1.cosmote.net.domain: 34441+ PTR? 192.66.134.195.in-addr.arpa. (45)
12:07:11.604835 IP localhost > localhost: ICMP echo request, id 12774, seq 1, length 520
12:07:11.604858 IP localhost > localhost: ICMP echo reply, id 12774, seq 1, length 520
12:07:11.651910 IP6 anycastdns1.cosmote.net.domain > 2a02:1388:9e:a37c:3464:d170:5678:7d74.34240: 34441 NXDomain 0/1/0 (102)
12:07:11.652161 IP voyager.domain > localhost.51415: 58767 NXDomain 0/1/0 (102)
12:07:11.652596 IP localhost.34824 > voyager.domain: 58102+ PTR? 168.66.134.195.in-addr.arpa. (45)
12:07:11.652831 IP6 2a02:1388:9e:a37c:3464:d170:5678:7d74.34240 > anycastdns1.cosmote.net.domain: 28939+ PTR? 168.66.134.195.in-addr.arpa. (45)
12:07:11.714566 IP6 anycastdns1.cosmote.net.domain > 2a02:1388:9e:a37c:3464:d170:5678:7d74.34240: 28939 1/0/0 PTR galactica.di.uoa.gr. (78)
12:07:11.714804 IP voyager.domain > localhost.34824: 58102 1/0/0 PTR galactica.di.uoa.gr. (78)
12:07:11.715286 IP localhost.40238 > voyager.domain: 21499+ PTR? 238.66.134.195.in-addr.arpa. (45)
12:07:11.715523 IP6 2a02:1388:9e:a37c:3464:d170:5678:7d74.34240 > anycastdns1.cosmote.net.domain: 63617+ PTR? 238.66.134.195.in-addr.arpa. (45)
12:07:11.805762 IP localhost > localhost: ICMP echo request, id 12774, seq 2, length 520
12:07:11.805787 IP localhost > localhost: ICMP echo reply, id 12774, seq 2, length 520
12:07:11.827814 IP6 anycastdns1.cosmote.net.domain > 2a02:1388:9e:a37c:3464:d170:5678:7d74.34240: 63617 1/0/0 PTR kthnos.di.uoa.gr. (75)
12:07:11.828064 IP voyager.domain > localhost.40238: 21499 1/0/0 PTR kthnos.di.uoa.gr. (75)
12:07:11.829465 IP localhost.56299 > voyager.domain: 32148+ PTR? 250.71.134.195.in-addr.arpa. (45)
12:07:11.829697 IP6 2a02:1388:9e:a37c:3464:d170:5678:7d74.34240 > anycastdns1.cosmote.net.domain: 64825+ PTR? 250.71.134.195.in-addr.arpa. (45)
12:07:11.910036 IP 195.134.66.217.17500 > 255.255.255.255.17500: UDP, length 206
12:07:11.910995 IP 195.134.66.217.17500 > 255.255.255.255.17500: UDP, length 206
12:07:11.911016 IP 195.134.66.217.17500 > 195.134.66.255.17500: UDP, length 206
12:07:11.992350 IP6 anycastdns1.cosmote.net.domain > 2a02:1388:9e:a37c:3464:d170:5678:7d74.34240: 64825 1/0/0 PTR fabulous.di.uoa.gr. (77)
12:07:11.992600 IP voyager.domain > localhost.56299: 32148 1/0/0 PTR fabulous.di.uoa.gr. (77)
12:07:11.993064 IP localhost.59738 > voyager.domain: 63095+ PTR? 12.43.168.192.in-addr.arpa. (44)
12:07:11.993372 IP6 2a02:1388:9e:a37c:3464:d170:5678:7d74.34240 > anycastdns1.cosmote.net.domain: 25381+ PTR? 12.43.168.192.in-addr.arpa. (44)
12:07:12.009654 IP localhost > localhost: ICMP echo request, id 12774, seq 3, length 520
12:07:12.009682 IP localhost > localhost: ICMP echo reply, id 12774, seq 3, length 520
12:07:12.032306 IP6 anycastdns1.cosmote.net.domain > 2a02:1388:9e:a37c:3464:d170:5678:7d74.34240: 25381 NXDomain 0/1/0 (121)
12:07:12.032557 IP voyager.domain > localhost.59738: 63095 NXDomain 0/1/0 (121)
12:07:12.033045 IP localhost.34583 > voyager.domain: 18927+ PTR? 214.66.134.195.in-addr.arpa. (45)
12:07:12.033342 IP6 2a02:1388:9e:a37c:3464:d170:5678:7d74.34240 > anycastdns1.cosmote.net.domain: 41306+ PTR? 214.66.134.195.in-addr.arpa. (45)
12:07:12.061407 ARP, Request who-has 195.134.66.214 tell esperos.di.uoa.gr, length 46
12:07:12.089107 IP6 anycastdns1.cosmote.net.domain > 2a02:1388:9e:a37c:3464:d170:5678:7d74.34240: 41306 NXDomain 0/1/0 (102)
12:07:12.089403 IP voyager.domain > localhost.34583: 18927 NXDomain 0/1/0 (102)
12:07:12.089822 IP localhost.41569 > voyager.domain: 11870+ PTR? 96.66.134.195.in-addr.arpa. (44)
12:07:12.090062 IP6 2a02:1388:9e:a37c:3464:d170:5678:7d74.34240 > anycastdns1.cosmote.net.domain: 64206+ PTR? 96.66.134.195.in-addr.arpa. (44)
12:07:12.146886 IP6 anycastdns1.cosmote.net.domain > 2a02:1388:9e:a37c:3464:d170:5678:7d74.34240: 64206 1/0/0 PTR esperos.di.uoa.gr. (75)
12:07:12.147132 IP voyager.domain > localhost.41569: 11870 1/0/0 PTR esperos.di.uoa.gr. (75)
12:07:12.147889 IP localhost.54264 > voyager.domain: 8126+ PTR? 1.43.168.192.in-addr.arpa. (43)
12:07:12.148121 IP6 2a02:1388:9e:a37c:3464:d170:5678:7d74.34240 > anycastdns1.cosmote.net.domain: 21988+ PTR? 1.43.168.192.in-addr.arpa. (43)
12:07:12.181505 IP6 anycastdns1.cosmote.net.domain > 2a02:1388:9e:a37c:3464:d170:5678:7d74.34240: 21988 NXDomain 0/1/0 (120)
12:07:12.181831 IP voyager.domain > localhost.54264: 8126 NXDomain 0/1/0 (120)
12:07:12.182357 IP localhost.59304 > voyager.domain: 26063+ PTR? 3.5.0.0.0.0.0.0.0.0.0.0.0.0.0.0.2.0.0.0.1.0.0.0.8.8.3.1.2.0.a.2.ip6.arpa. (90)
12:07:12.182535 IP6 2a02:1388:9e:a37c:3464:d170:5678:7d74.34240 > anycastdns1.cosmote.net.domain: 54759+ PTR? 3.5.0.0.0.0.0.0.0.0.0.0.0.0.0.0.2.0.0.0.1.0.0.0.8.8.3.1.2.0.a.2.ip6.arpa. (90)
12:07:12.184367 ARP, Request who-has 195.134.66.2 tell 195.134.66.1, length 46
12:07:12.190630 ARP, Request who-has chloe.di.uoa.gr tell 195.134.66.1, length 46
12:07:12.197302 ARP, Request who-has thalis-3.di.uoa.gr tell 195.134.66.1, length 46
12:07:12.213597 IP localhost > localhost: ICMP echo request, id 12774, seq 4, length 520
12:07:12.213624 IP localhost > localhost: ICMP echo reply, id 12774, seq 4, length 520
12:07:12.222510 IP6 anycastdns1.cosmote.net.domain > 2a02:1388:9e:a37c:3464:d170:5678:7d74.34240: 54759 1/0/0 PTR anycastdns1.cosmote.net. (127)
12:07:12.222791 IP voyager.domain > localhost.59304: 26063 1/0/0 PTR anycastdns1.cosmote.net. (127)
12:07:12.223250 IP localhost.55437 > voyager.domain: 38543+ PTR? 4.7.d.7.8.7.6.5.0.7.1.d.4.6.4.3.c.7.3.a.e.9.0.0.8.8.3.1.2.0.a.2.ip6.arpa. (90)
12:07:12.223498 IP6 2a02:1388:9e:a37c:3464:d170:5678:7d74.34240 > anycastdns1.cosmote.net.domain: 34393+ PTR? 4.7.d.7.8.7.6.5.0.7.1.d.4.6.4.3.c.7.3.a.e.9.0.0.8.8.3.1.2.0.a.2.ip6.arpa. (90)
12:07:12.306636 IP6 anycastdns1.cosmote.net.domain > 2a02:1388:9e:a37c:3464:d170:5678:7d74.34240: 34393 NXDomain 0/1/0 (156)
12:07:12.306901 IP voyager.domain > localhost.55437: 38543 NXDomain 0/1/0 (156)
12:07:12.307328 IP localhost.51661 > voyager.domain: 20245+ PTR? 3.5.0.0.0.0.0.0.0.0.0.0.0.0.0.0.2.0.0.0.1.0.0.2.8.8.3.1.2.0.a.2.ip6.arpa. (90)
12:07:12.307517 IP6 2a02:1388:9e:a37c:3464:d170:5678:7d74.34240 > anycastdns1.cosmote.net.domain: 59463+ PTR? 3.5.0.0.0.0.0.0.0.0.0.0.0.0.0.0.2.0.0.0.1.0.0.2.8.8.3.1.2.0.a.2.ip6.arpa. (90)
12:07:12.387359 IP6 anycastdns1.cosmote.net.domain > 2a02:1388:9e:a37c:3464:d170:5678:7d74.34240: 59463 1/0/0 PTR anycastdns2.cosmote.net. (127)
12:07:12.387650 IP voyager.domain > localhost.51661: 20245 1/0/0 PTR anycastdns2.cosmote.net. (127)
12:07:12.388695 IP localhost.37932 > voyager.domain: 58395+ PTR? 255.255.255.255.in-addr.arpa. (46)
12:07:12.388902 IP6 2a02:1388:9e:a37c:3464:d170:5678:7d74.34240 > anycastdns1.cosmote.net.domain: 27362+ PTR? 255.255.255.255.in-addr.arpa. (46)
12:07:12.417556 IP localhost > localhost: ICMP echo request, id 12774, seq 5, length 520
12:07:12.417570 IP localhost > localhost: ICMP echo reply, id 12774, seq 5, length 520
12:07:12.461093 ARP, Request who-has vasso.di.uoa.gr tell 195.134.66.1, length 46
12:07:12.483412 IP6 anycastdns1.cosmote.net.domain > 2a02:1388:9e:a37c:3464:d170:5678:7d74.34240: 27362 NXDomain 0/1/0 (114)
12:07:12.483663 IP voyager.domain > localhost.37932: 58395 NXDomain 0/1/0 (114)
12:07:12.484073 IP localhost.36221 > voyager.domain: 51042+ PTR? 164.66.134.195.in-addr.arpa. (45)
12:07:12.484303 IP6 2a02:1388:9e:a37c:3464:d170:5678:7d74.34240 > anycastdns1.cosmote.net.domain: 7923+ PTR? 164.66.134.195.in-addr.arpa. (45)
12:07:12.525082 IP6 anycastdns1.cosmote.net.domain > 2a02:1388:9e:a37c:3464:d170:5678:7d74.34240: 7923 1/0/0 PTR yperionas.di.uoa.gr. (78)
12:07:12.525371 IP voyager.domain > localhost.36221: 51042 1/0/0 PTR yperionas.di.uoa.gr. (78)
12:07:12.525813 IP localhost.60460 > voyager.domain: 24610+ PTR? 255.66.134.195.in-addr.arpa. (45)
12:07:12.526051 IP6 2a02:1388:9e:a37c:3464:d170:5678:7d74.34240 > anycastdns1.cosmote.net.domain: 57560+ PTR? 255.66.134.195.in-addr.arpa. (45)
12:07:12.568919 IP6 anycastdns1.cosmote.net.domain > 2a02:1388:9e:a37c:3464:d170:5678:7d74.34240: 57560 NXDomain 0/1/0 (102)
12:07:12.569164 IP voyager.domain > localhost.60460: 24610 NXDomain 0/1/0 (102)
12:07:12.570278 IP localhost.56741 > voyager.domain: 55846+ PTR? 107.66.134.195.in-addr.arpa. (45)
12:07:12.570525 IP6 2a02:1388:9e:a37c:3464:d170:5678:7d74.34240 > anycastdns1.cosmote.net.domain: 8766+ PTR? 107.66.134.195.in-addr.arpa. (45)
12:07:12.580823 ARP, Request who-has 195.134.66.221 tell 195.134.66.1, length 46
12:07:12.621414 IP localhost > localhost: ICMP echo request, id 12774, seq 6, length 520
12:07:12.621443 IP localhost > localhost: ICMP echo reply, id 12774, seq 6, length 520
12:07:12.631007 IP6 anycastdns1.cosmote.net.domain > 2a02:1388:9e:a37c:3464:d170:5678:7d74.34240: 8766 1/0/0 PTR spiderman.di.uoa.gr. (78)
12:07:12.631259 IP voyager.domain > localhost.56741: 55846 1/0/0 PTR spiderman.di.uoa.gr. (78)
12:07:12.632245 IP localhost.37177 > voyager.domain: 26344+ PTR? 217.66.134.195.in-addr.arpa. (45)
12:07:12.632490 IP6 2a02:1388:9e:a37c:3464:d170:5678:7d74.34240 > anycastdns1.cosmote.net.domain: 56699+ PTR? 217.66.134.195.in-addr.arpa. (45)
12:07:12.687256 IP6 anycastdns1.cosmote.net.domain > 2a02:1388:9e:a37c:3464:d170:5678:7d74.34240: 56699 NXDomain 0/1/0 (102)
12:07:12.687530 IP voyager.domain > localhost.37177: 26344 NXDomain 0/1/0 (102)
12:07:12.688431 IP localhost.57011 > voyager.domain: 61841+ PTR? 2.66.134.195.in-addr.arpa. (43)
12:07:12.688657 IP6 2a02:1388:9e:a37c:3464:d170:5678:7d74.34240 > anycastdns1.cosmote.net.domain: 17239+ PTR? 2.66.134.195.in-addr.arpa. (43)
12:07:12.724801 IP6 anycastdns1.cosmote.net.domain > 2a02:1388:9e:a37c:3464:d170:5678:7d74.34240: 17239 NXDomain 0/1/0 (100)
12:07:12.725052 IP voyager.domain > localhost.57011: 61841 NXDomain 0/1/0 (100)
12:07:12.725501 IP localhost.40929 > voyager.domain: 49913+ PTR? 20.66.134.195.in-addr.arpa. (44)
12:07:12.725680 IP6 2a02:1388:9e:a37c:3464:d170:5678:7d74.34240 > anycastdns1.cosmote.net.domain: 14919+ PTR? 20.66.134.195.in-addr.arpa. (44)
12:07:12.746485 IP moon.di.uoa.gr.57621 > 195.134.66.255.57621: UDP, length 44
12:07:12.788869 ARP, Request who-has ivan.di.uoa.gr tell 195.134.66.1, length 46
12:07:12.795452 ARP, Request who-has 195.134.66.197 tell 195.134.66.1, length 46
12:07:12.802129 IP6 anycastdns1.cosmote.net.domain > 2a02:1388:9e:a37c:3464:d170:5678:7d74.34240: 14919 1/0/0 PTR chloe.di.uoa.gr. (73)
12:07:12.802374 IP voyager.domain > localhost.40929: 49913 1/0/0 PTR chloe.di.uoa.gr. (73)
12:07:12.802776 IP localhost.45151 > voyager.domain: 1185+ PTR? 93.66.134.195.in-addr.arpa. (44)
12:07:12.802955 IP6 2a02:1388:9e:a37c:3464:d170:5678:7d74.34240 > anycastdns1.cosmote.net.domain: 20452+ PTR? 93.66.134.195.in-addr.arpa. (44)
12:07:12.825651 IP localhost > localhost: ICMP echo request, id 12774, seq 7, length 520
12:07:12.825678 IP localhost > localhost: ICMP echo reply, id 12774, seq 7, length 520
12:07:12.863877 IP6 anycastdns1.cosmote.net.domain > 2a02:1388:9e:a37c:3464:d170:5678:7d74.34240: 20452 1/0/0 PTR thalis-3.di.uoa.gr. (76)
12:07:12.864107 IP voyager.domain > localhost.45151: 1185 1/0/0 PTR thalis-3.di.uoa.gr. (76)
12:07:13.029637 IP localhost > localhost: ICMP echo request, id 12774, seq 8, length 520
12:07:13.029663 IP localhost > localhost: ICMP echo reply, id 12774, seq 8, length 520
12:07:13.233681 IP localhost > localhost: ICMP echo request, id 12774, seq 9, length 520
12:07:13.233707 IP localhost > localhost: ICMP echo reply, id 12774, seq 9, length 520
12:07:13.353674 IP localhost.58918 > voyager.domain: 47557+ PTR? 37.66.134.195.in-addr.arpa. (44)
12:07:13.353911 IP6 2a02:1388:9e:a37c:3464:d170:5678:7d74.34240 > anycastdns1.cosmote.net.domain: 57780+ PTR? 37.66.134.195.in-addr.arpa. (44)
12:07:13.399872 IP jupiter.di.uoa.gr.17500 > 255.255.255.255.17500: UDP, length 330
12:07:13.399895 IP jupiter.di.uoa.gr.17500 > 195.134.66.255.17500: UDP, length 330
12:07:13.411011 IP6 anycastdns1.cosmote.net.domain > 2a02:1388:9e:a37c:3464:d170:5678:7d74.34240: 57780 1/0/0 PTR vasso.di.uoa.gr. (73)
12:07:13.411250 IP voyager.domain > localhost.58918: 47557 1/0/0 PTR vasso.di.uoa.gr. (73)
12:07:13.412043 IP localhost.36368 > voyager.domain: 37823+ PTR? 221.66.134.195.in-addr.arpa. (45)
12:07:13.412249 IP6 2a02:1388:9e:a37c:3464:d170:5678:7d74.34240 > anycastdns1.cosmote.net.domain: 17304+ PTR? 221.66.134.195.in-addr.arpa. (45)
12:07:13.437445 IP localhost > localhost: ICMP echo request, id 12774, seq 10, length 520
12:07:13.437470 IP localhost > localhost: ICMP echo reply, id 12774, seq 10, length 520
12:07:13.445428 IP 192.168.43.12.46752 > fabulous.di.uoa.gr.9092: Flags [P.], seq 157:210, ack 5861, win 349, options [nop,nop,TS val 1323927871 ecr 581060138], length 53
12:07:13.447118 IP localhost > localhost: ICMP echo request, id 12777, seq 1, length 520
12:07:13.447123 IP localhost > localhost: ICMP echo reply, id 12777, seq 1, length 520
12:07:13.450921 IP6 anycastdns1.cosmote.net.domain > 2a02:1388:9e:a37c:3464:d170:5678:7d74.34240: 17304 NXDomain 0/1/0 (102)
12:07:13.450974 IP voyager.domain > localhost.36368: 37823 NXDomain 0/1/0 (102)
12:07:13.451086 IP localhost.55954 > voyager.domain: 8125+ PTR? 122.66.134.195.in-addr.arpa. (45)
12:07:13.451114 IP6 2a02:1388:9e:a37c:3464:d170:5678:7d74.34240 > anycastdns1.cosmote.net.domain: 42179+ PTR? 122.66.134.195.in-addr.arpa. (45)
12:07:13.509500 IP 192.168.43.12.40018 > fra16s18-in-f4.1e100.net.https: Flags [P.], seq 1438784578:1438784624, ack 177021642, win 567, options [nop,nop,TS val 2596020692 ecr 1210786438], length 46
12:07:13.510168 IP 192.168.43.12.40018 > fra16s18-in-f4.1e100.net.https: Flags [P.], seq 46:77, ack 1, win 567, options [nop,nop,TS val 2596020692 ecr 1210786438], length 31
12:07:13.510223 IP 192.168.43.12.40018 > fra16s18-in-f4.1e100.net.https: Flags [F.], seq 77, ack 1, win 567, options [nop,nop,TS val 2596020692 ecr 1210786438], length 0
12:07:13.544333 IP fabulous.di.uoa.gr.9092 > 192.168.43.12.46752: Flags [P.], seq 5861:5956, ack 210, win 14480, options [nop,nop,TS val 581060627 ecr 1323927871], length 95
12:07:13.544411 IP 192.168.43.12.46752 > fabulous.di.uoa.gr.9092: Flags [.], ack 5956, win 349, options [nop,nop,TS val 1323927970 ecr 581060627], length 0
12:07:13.544591 IP6 anycastdns1.cosmote.net.domain > 2a02:1388:9e:a37c:3464:d170:5678:7d74.34240: 42179 1/0/0 PTR moon.di.uoa.gr. (73)
12:07:13.544838 IP voyager.domain > localhost.55954: 8125 1/0/0 PTR moon.di.uoa.gr. (73)
12:07:13.545409 IP fra16s18-in-f4.1e100.net.https > 192.168.43.12.40018: Flags [.], ack 0, win 1537, options [nop,nop,TS val 1210839900 ecr 2595967317], length 0
12:07:13.545430 IP localhost.59248 > voyager.domain: 51795+ PTR? 173.66.134.195.in-addr.arpa. (45)
12:07:13.545627 IP6 2a02:1388:9e:a37c:3464:d170:5678:7d74.34240 > anycastdns1.cosmote.net.domain: 54429+ PTR? 173.66.134.195.in-addr.arpa. (45)
12:07:13.550066 IP 192.168.43.12.46752 > fabulous.di.uoa.gr.9092: Flags [P.], seq 210:484, ack 5956, win 349, options [nop,nop,TS val 1323927975 ecr 581060627], length 274
12:07:13.554129 IP fra16s18-in-f4.1e100.net.https > 192.168.43.12.40018: Flags [.], ack 46, win 1540, options [nop,nop,TS val 1210839916 ecr 2596020692], length 0
12:07:13.555143 IP fra16s18-in-f4.1e100.net.https > 192.168.43.12.40018: Flags [.], ack 78, win 1542, options [nop,nop,TS val 1210839917 ecr 2596020692], length 0
12:07:13.597709 IP fra16s18-in-f4.1e100.net.https > 192.168.43.12.40018: Flags [F.], seq 1, ack 78, win 1542, options [nop,nop,TS val 1210839954 ecr 2596020692], length 0
12:07:13.597744 IP 192.168.43.12.40018 > fra16s18-in-f4.1e100.net.https: Flags [.], ack 2, win 567, options [nop,nop,TS val 2596020780 ecr 1210839954], length 0
12:07:13.602645 IP6 anycastdns1.cosmote.net.domain > 2a02:1388:9e:a37c:3464:d170:5678:7d74.34240: 54429 1/0/0 PTR ivan.di.uoa.gr. (73)
12:07:13.602835 IP voyager.domain > localhost.59248: 51795 1/0/0 PTR ivan.di.uoa.gr. (73)
12:07:13.603138 IP localhost.36582 > voyager.domain: 52472+ PTR? 197.66.134.195.in-addr.arpa. (45)
12:07:13.603298 IP6 2a02:1388:9e:a37c:3464:d170:5678:7d74.34240 > anycastdns1.cosmote.net.domain: 63753+ PTR? 197.66.134.195.in-addr.arpa. (45)
12:07:13.622343 IP fabulous.di.uoa.gr.9092 > 192.168.43.12.46752: Flags [P.], seq 5956:6010, ack 484, win 15016, options [nop,nop,TS val 581060649 ecr 1323927975], length 54
12:07:13.649685 IP localhost > localhost: ICMP echo request, id 12777, seq 2, length 520
12:07:13.649713 IP localhost > localhost: ICMP echo reply, id 12777, seq 2, length 520
12:07:13.662503 IP6 anycastdns1.cosmote.net.domain > 2a02:1388:9e:a37c:3464:d170:5678:7d74.34240: 63753 NXDomain 0/1/0 (102)
12:07:13.662755 IP voyager.domain > localhost.36582: 52472 NXDomain 0/1/0 (102)
12:07:13.665515 IP 192.168.43.12.46752 > fabulous.di.uoa.gr.9092: Flags [.], ack 6010, win 349, options [nop,nop,TS val 1323928091 ecr 581060649], length 0
12:07:13.824029 IP 195.134.66.9.38040 > 195.134.66.255.21027: UDP, length 283
12:07:13.853462 IP localhost > localhost: ICMP echo request, id 12777, seq 3, length 520
12:07:13.853496 IP localhost > localhost: ICMP echo reply, id 12777, seq 3, length 520
12:07:14.057652 IP localhost > localhost: ICMP echo request, id 12777, seq 4, length 520
12:07:14.057679 IP localhost > localhost: ICMP echo reply, id 12777, seq 4, length 520
12:07:14.261811 IP localhost > localhost: ICMP echo request, id 12777, seq 5, length 520
12:07:14.261839 IP localhost > localhost: ICMP echo reply, id 12777, seq 5, length 520
12:07:14.378042 IP localhost.33104 > voyager.domain: 34476+ PTR? 85.66.134.195.in-addr.arpa. (44)
12:07:14.378317 IP6 2a02:1388:9e:a37c:3464:d170:5678:7d74.34240 > anycastdns1.cosmote.net.domain: 23732+ PTR? 85.66.134.195.in-addr.arpa. (44)
12:07:14.422331 IP6 anycastdns1.cosmote.net.domain > 2a02:1388:9e:a37c:3464:d170:5678:7d74.34240: 23732 1/0/0 PTR jupiter.di.uoa.gr. (75)
12:07:14.422570 IP voyager.domain > localhost.33104: 34476 1/0/0 PTR jupiter.di.uoa.gr. (75)
12:07:14.423464 IP localhost.36016 > voyager.domain: 18573+ PTR? 132.23.217.172.in-addr.arpa. (45)
12:07:14.423714 IP6 2a02:1388:9e:a37c:3464:d170:5678:7d74.34240 > anycastdns1.cosmote.net.domain: 3192+ PTR? 132.23.217.172.in-addr.arpa. (45)
12:07:14.462157 IP6 anycastdns1.cosmote.net.domain > 2a02:1388:9e:a37c:3464:d170:5678:7d74.34240: 3192 2/0/0 PTR fra16s18-in-f4.1e100.net., PTR fra16s18-in-f132.1e100.net. (114)
12:07:14.462400 IP voyager.domain > localhost.36016: 18573 2/0/0 PTR fra16s18-in-f4.1e100.net., PTR fra16s18-in-f132.1e100.net. (114)
12:07:14.463362 IP localhost.47604 > voyager.domain: 924+ PTR? 9.66.134.195.in-addr.arpa. (43)
12:07:14.463604 IP6 2a02:1388:9e:a37c:3464:d170:5678:7d74.34240 > anycastdns1.cosmote.net.domain: 5776+ PTR? 9.66.134.195.in-addr.arpa. (43)
12:07:14.465584 IP localhost > localhost: ICMP echo request, id 12777, seq 6, length 520
12:07:14.465611 IP localhost > localhost: ICMP echo reply, id 12777, seq 6, length 520
12:07:14.502292 IP6 anycastdns1.cosmote.net.domain > 2a02:1388:9e:a37c:3464:d170:5678:7d74.34240: 5776 NXDomain 0/1/0 (100)
12:07:14.502532 IP voyager.domain > localhost.47604: 924 NXDomain 0/1/0 (100)
12:07:14.507964 IP 192.168.43.12.36608 > ec2-34-237-73-95.compute-1.amazonaws.com.https: Flags [P.], seq 1957686709:1957686997, ack 1058426743, win 590, options [nop,nop,TS val 3885825668 ecr 1210804012], length 288
12:07:14.509888 IP 192.168.43.12.40328 > fra15s18-in-f110.1e100.net.https: Flags [P.], seq 4012225223:4012225269, ack 554062201, win 295, options [nop,nop,TS val 828982632 ecr 1210788465], length 46
12:07:14.510124 IP 192.168.43.12.44592 > fra15s16-in-f35.1e100.net.https: Flags [P.], seq 1361454062:1361454108, ack 3359718707, win 316, options [nop,nop,TS val 916032849 ecr 1210788472], length 46
12:07:14.510627 IP 192.168.43.12.40328 > fra15s18-in-f110.1e100.net.https: Flags [P.], seq 46:77, ack 1, win 295, options [nop,nop,TS val 828982633 ecr 1210788465], length 31
12:07:14.510693 IP 192.168.43.12.40328 > fra15s18-in-f110.1e100.net.https: Flags [F.], seq 77, ack 1, win 295, options [nop,nop,TS val 828982633 ecr 1210788465], length 0
12:07:14.511116 IP 192.168.43.12.44592 > fra15s16-in-f35.1e100.net.https: Flags [P.], seq 46:77, ack 1, win 316, options [nop,nop,TS val 916032850 ecr 1210788472], length 31
12:07:14.511175 IP 192.168.43.12.44592 > fra15s16-in-f35.1e100.net.https: Flags [F.], seq 77, ack 1, win 316, options [nop,nop,TS val 916032850 ecr 1210788472], length 0
12:07:14.552168 IP fra15s18-in-f110.1e100.net.https > 192.168.43.12.40328: Flags [.], ack 0, win 1417, options [nop,nop,TS val 1210840915 ecr 828930234], length 0
12:07:14.556906 IP 195.134.66.1 > all-systems.mcast.net: igmp query v3
12:07:14.560068 IP ec2-34-237-73-95.compute-1.amazonaws.com.https > 192.168.43.12.36608: Flags [.], ack 288, win 1830, options [nop,nop,TS val 1210840922 ecr 3885825668], length 0
12:07:14.562704 IP fra15s16-in-f35.1e100.net.https > 192.168.43.12.44592: Flags [.], ack 0, win 1417, options [nop,nop,TS val 1210840923 ecr 915980456], length 0
12:07:14.566033 IP fra15s18-in-f110.1e100.net.https > 192.168.43.12.40328: Flags [.], ack 46, win 1420, options [nop,nop,TS val 1210840925 ecr 828982632], length 0
12:07:14.566379 IP fra15s16-in-f35.1e100.net.https > 192.168.43.12.44592: Flags [.], ack 46, win 1420, options [nop,nop,TS val 1210840927 ecr 916032849], length 0
12:07:14.567352 IP fra15s18-in-f110.1e100.net.https > 192.168.43.12.40328: Flags [.], ack 78, win 1422, options [nop,nop,TS val 1210840928 ecr 828982633], length 0
12:07:14.567432 IP fra15s16-in-f35.1e100.net.https > 192.168.43.12.44592: Flags [.], ack 78, win 1422, options [nop,nop,TS val 1210840929 ecr 916032850], length 0
12:07:14.602396 IP fra15s18-in-f110.1e100.net.https > 192.168.43.12.40328: Flags [F.], seq 1, ack 78, win 1422, options [nop,nop,TS val 1210840965 ecr 828982633], length 0
12:07:14.602483 IP 192.168.43.12.40328 > fra15s18-in-f110.1e100.net.https: Flags [.], ack 2, win 295, options [nop,nop,TS val 828982725 ecr 1210840965], length 0
12:07:14.611151 IP fra15s16-in-f35.1e100.net.https > 192.168.43.12.44592: Flags [F.], seq 1, ack 78, win 1422, options [nop,nop,TS val 1210840973 ecr 916032850], length 0
12:07:14.611211 IP 192.168.43.12.44592 > fra15s16-in-f35.1e100.net.https: Flags [.], ack 2, win 316, options [nop,nop,TS val 916032950 ecr 1210840973], length 0
12:07:14.633429 ARP, Request who-has 195.134.66.110 tell maya.di.uoa.gr, length 46
12:07:14.662862 ARP, Request who-has survey.di.uoa.gr tell 195.134.66.1, length 46
12:07:14.669645 IP localhost > localhost: ICMP echo request, id 12777, seq 7, length 520
12:07:14.669671 IP localhost > localhost: ICMP echo reply, id 12777, seq 7, length 520
12:07:14.704005 IP ec2-34-237-73-95.compute-1.amazonaws.com.https > 192.168.43.12.36608: Flags [P.], seq 1:326, ack 288, win 1830, options [nop,nop,TS val 1210841058 ecr 3885825668], length 325
12:07:14.704057 IP 192.168.43.12.36608 > ec2-34-237-73-95.compute-1.amazonaws.com.https: Flags [.], ack 326, win 611, options [nop,nop,TS val 3885825864 ecr 1210841058], length 0
12:07:14.873765 IP localhost > localhost: ICMP echo request, id 12777, seq 8, length 520
12:07:14.873792 IP localhost > localhost: ICMP echo reply, id 12777, seq 8, length 520
12:07:15.077391 IP localhost > localhost: ICMP echo request, id 12777, seq 9, length 520
12:07:15.077425 IP localhost > localhost: ICMP echo reply, id 12777, seq 9, length 520
12:07:15.281841 IP localhost > localhost: ICMP echo request, id 12777, seq 10, length 520
12:07:15.281871 IP localhost > localhost: ICMP echo reply, id 12777, seq 10, length 520
12:07:15.291267 IP 192.168.43.12.46752 > fabulous.di.uoa.gr.9092: Flags [P.], seq 484:758, ack 6010, win 349, options [nop,nop,TS val 1323929716 ecr 581060649], length 274
12:07:15.292056 IP localhost > localhost: ICMP echo request, id 12780, seq 1, length 520
12:07:15.292063 IP localhost > localhost: ICMP echo reply, id 12780, seq 1, length 520
12:07:15.365736 IP fabulous.di.uoa.gr.9092 > 192.168.43.12.46752: Flags [P.], seq 6010:6064, ack 758, win 15552, options [nop,nop,TS val 581061085 ecr 1323929716], length 54
12:07:15.365828 IP 192.168.43.12.46752 > fabulous.di.uoa.gr.9092: Flags [.], ack 6064, win 349, options [nop,nop,TS val 1323929791 ecr 581061085], length 0
12:07:15.402219 IP localhost.59442 > voyager.domain: 51179+ PTR? 95.73.237.34.in-addr.arpa. (43)
12:07:15.402491 IP6 2a02:1388:9e:a37c:3464:d170:5678:7d74.34240 > anycastdns1.cosmote.net.domain: 53158+ PTR? 95.73.237.34.in-addr.arpa. (43)
12:07:15.414504 ARP, Request who-has 195.134.66.110 tell maya.di.uoa.gr, length 46
12:07:15.493842 IP localhost > localhost: ICMP echo request, id 12780, seq 2, length 520
12:07:15.493874 IP localhost > localhost: ICMP echo reply, id 12780, seq 2, length 520
12:07:15.509140 IP 192.168.43.12.39596 > ec2-100-26-125-169.compute-1.amazonaws.com.https: Flags [P.], seq 4042867944:4042868232, ack 1505004195, win 569, options [nop,nop,TS val 976600353 ecr 1210806915], length 288
12:07:15.510754 IP 192.168.43.12.37360 > fra15s29-in-f14.1e100.net.https: Flags [P.], seq 1073000971:1073001017, ack 1955393032, win 358, options [nop,nop,TS val 2905590252 ecr 1210788465], length 46
12:07:15.511195 IP 192.168.43.12.37360 > fra15s29-in-f14.1e100.net.https: Flags [FP.], seq 46:77, ack 1, win 358, options [nop,nop,TS val 2905590252 ecr 1210788465], length 31
12:07:15.543684 IP6 anycastdns1.cosmote.net.domain > 2a02:1388:9e:a37c:3464:d170:5678:7d74.34240: 53158 1/0/0 PTR ec2-34-237-73-95.compute-1.amazonaws.com. (97)
12:07:15.543933 IP voyager.domain > localhost.59442: 51179 1/0/0 PTR ec2-34-237-73-95.compute-1.amazonaws.com. (97)
12:07:15.544439 IP localhost.37039 > voyager.domain: 8356+ PTR? 110.22.217.172.in-addr.arpa. (45)
12:07:15.544681 IP6 2a02:1388:9e:a37c:3464:d170:5678:7d74.34240 > anycastdns1.cosmote.net.domain: 21213+ PTR? 110.22.217.172.in-addr.arpa. (45)
12:07:15.566023 IP ec2-100-26-125-169.compute-1.amazonaws.com.https > 192.168.43.12.39596: Flags [.], ack 288, win 1830, options [nop,nop,TS val 1210841929 ecr 976600353], length 0
12:07:15.566327 IP fra15s29-in-f14.1e100.net.https > 192.168.43.12.37360: Flags [.], ack 46, win 1480, options [nop,nop,TS val 1210841929 ecr 2905590252], length 0
12:07:15.581983 IP fra15s29-in-f14.1e100.net.https > 192.168.43.12.37360: Flags [.], ack 78, win 1482, options [nop,nop,TS val 1210841929 ecr 2905590252], length 0
12:07:15.582060 IP6 anycastdns1.cosmote.net.domain > 2a02:1388:9e:a37c:3464:d170:5678:7d74.34240: 21213 2/0/0 PTR fra15s18-in-f110.1e100.net., PTR fra15s18-in-f14.1e100.net. (115)
12:07:15.582407 IP voyager.domain > localhost.37039: 8356 2/0/0 PTR fra15s18-in-f110.1e100.net., PTR fra15s18-in-f14.1e100.net. (115)
12:07:15.582875 IP localhost.50129 > voyager.domain: 29626+ PTR? 35.22.217.172.in-addr.arpa. (44)
12:07:15.583108 IP6 2a02:1388:9e:a37c:3464:d170:5678:7d74.34240 > anycastdns1.cosmote.net.domain: 15831+ PTR? 35.22.217.172.in-addr.arpa. (44)
12:07:15.603489 IP fra15s29-in-f14.1e100.net.https > 192.168.43.12.37360: Flags [F.], seq 1, ack 78, win 1482, options [nop,nop,TS val 1210841966 ecr 2905590252], length 0
12:07:15.603562 IP 192.168.43.12.37360 > fra15s29-in-f14.1e100.net.https: Flags [.], ack 2, win 358, options [nop,nop,TS val 2905590345 ecr 1210841966], length 0
12:07:15.623648 IP6 anycastdns1.cosmote.net.domain > 2a02:1388:9e:a37c:3464:d170:5678:7d74.34240: 15831 2/0/0 PTR fra15s16-in-f35.1e100.net., PTR fra15s16-in-f3.1e100.net. (112)
12:07:15.623897 IP voyager.domain > localhost.50129: 29626 2/0/0 PTR fra15s16-in-f35.1e100.net., PTR fra15s16-in-f3.1e100.net. (112)
12:07:15.624647 IP localhost.43383 > voyager.domain: 21928+ PTR? 1.0.0.224.in-addr.arpa. (40)
